{"schema":"dinhot.model-card/v1","slot":"cgh-net","onnx":"models/cgh-net.onnx","sha256":"f83e440e4a47b49917beaace6555d4608b9312e6625b5dd5e91cc9da705f2da6","bytes":1048576,"opset":17,"inputs":[{"name":"target","shape":[1,1,128,128],"dtype":"float32"}],"outputs":[{"name":"phase","shape":[1,1,128,128],"dtype":"float32"}],"grid":128,"trained_on":{"en":"Synthetic target and phase pairs from the engine.","es":"Pares sintéticos objetivo y fase del motor."},"held_out":{"en":"200 held-out targets never used in training.","es":"200 objetivos reservados que no se usaron en el entrenamiento."},"metrics_path":"data/derived/models/metrics.json"}