{"schema":"dinhot.model-card/v1","slot":"cgh-net","onnx":"models/cgh-net.onnx","sha256":"72d86b6699c158c093a3d18da759d69b343819838ce4047d9b9ffb2089256535","bytes":4671540,"opset":17,"inputs":[{"name":"target","shape":[1,3,128,128],"dtype":"float32"}],"outputs":[{"name":"phase","shape":[1,1,128,128],"dtype":"float32"}],"trained_on":{"en":"16000 steps of batch 32 on three-plane targets drawn on the fly from a seeded generator (data seed 20261103, initialisation seed 13): point voxels at integer bins, equal counts per plane, random sets, shifted lattices, rings, mixed; planes at -8, 0, +8 SLM-limited Rayleigh ranges on the 128 x 128 focal crop (SLM 128 x 128, padding 1). Unsupervised: the loss is 1 - AC, the mean over the planes, through the differentiable FFT model with the plane lens phases. ONNX parity with torch is stated on the reconstructed plane intensities (max |dI| / max I over the planes = 8.42e-06), not on the phase, which is ill-conditioned where the SLM field is near zero.","es":"16000 pasos de lote 32 con objetivos de tres planos generados al vuelo por un generador con semilla (semilla de datos 20261103, semilla de inicializacion 13): voxeles puntuales en bins enteros, igual numero por plano, conjuntos aleatorios, redes desplazadas, anillos, mezclas; planos en -8, 0, +8 rangos de Rayleigh limitados por el SLM en el recorte focal de 128 x 128 (SLM de 128 x 128, relleno 1). Sin supervision: la perdida es 1 - AC, promedio sobre los planos, a traves del modelo FFT diferenciable con las fases de lente de cada plano. La paridad ONNX con torch se declara sobre las intensidades de plano reconstruidas (max |dI| / max I = 8.42e-06), no sobre la fase, mal condicionada donde el campo del SLM es casi nulo."},"held_out":{"en":"162 held-out volumes, written before training with other seeds (file sha256 3c974555676078b4756443e750793ae8c3a5bced595d673a0fa3092f1d316cb0); they include the benchmark geometries.","es":"162 volumenes reservados, escritos antes del entrenamiento con otras semillas (sha256 del archivo 3c974555676078b4756443e750793ae8c3a5bced595d673a0fa3092f1d316cb0); incluyen las geometrias del banco de pruebas."},"metrics_path":"data/derived/models/metrics.json","grid":128}