{"schema":"dinhot.model-card/v1","slot":"warmstart-model","onnx":"models/warmstart-model.onnx","sha256":"84d16ff475288e623f324632e4005a20da4cc3164a72ea0ef84817bfdfc51ea1","bytes":1048576,"opset":17,"inputs":[{"name":"traps","shape":[1,1024,4],"dtype":"float32"},{"name":"mask","shape":[1,1024],"dtype":"float32"}],"outputs":[{"name":"trap_phase","shape":[1,1024],"dtype":"float32"}],"trained_on":{"en":"Synthetic target and phase pairs from the engine.","es":"Pares sintéticos objetivo y fase del motor."},"held_out":{"en":"200 held-out targets never used in training.","es":"200 objetivos reservados que no se usaron en el entrenamiento."},"metrics_path":"data/derived/models/metrics.json"}